{
  "schema_version": "crypto.bracket-signal.v1",
  "signal_source": "crypto-simulator",
  "strategy_id": "spot_limit_retest_balanced_0p35_1p5_2R_14d",
  "strategy_version": "spot_limit_retest_balanced_0p35_1p5_2R_14d",
  "event_type": "crypto_investment_decision",
  "generated_at": "2026-10-25T21:39:38.060758+00:00",
  "idempotency_key": "decision:spot_limit_retest_balanced_0p35_1p5_2R_14d:2026-10-25T21:00:00+00:00:spot",
  "source": {
    "exchange": [
      "bitbank"
    ],
    "market": "spot",
    "interval": "1hour",
    "closed_bar_timestamp": "2026-10-25T21:00:00+00:00",
    "benchmark_symbol": "btc_jpy",
    "symbols": [
      "btc_jpy"
    ]
  },
  "decision": "no_trade",
  "recommended_action": "wait",
  "regime": {
    "label": "neutral",
    "state": "normal",
    "breadth": 1.0,
    "confidence": 0.0,
    "realized_volatility": null,
    "volatility_percentile": null,
    "new_long_allowed": false,
    "new_short_allowed": false
  },
  "ranking": [],
  "candidates": [],
  "no_trade_reason": "neutral_regime",
  "guardrails": {
    "market_order_fallback": false,
    "cancel_on_regime_flip": true,
    "limit_expiry_bars": 8,
    "max_holding_days": 14,
    "stop_target_same_bar_policy": "stop_first",
    "strategy_status": "research_candidate_only"
  },
  "strategy": {
    "name": "spot_limit_retest_balanced_0p35_1p5_2R_14d",
    "market": "spot",
    "execution_fast": 8,
    "execution_breakout_lookback": 12,
    "atr_window": 20,
    "trend_fast": 6,
    "trend_slow": 18,
    "regime_fast": 20,
    "regime_slow": 60,
    "relative_momentum_window": 6,
    "volume_window": 20,
    "volume_multiple": 1.0,
    "entry_offset_atr": 0.35,
    "stop_atr": 1.5,
    "take_profit_r": 2.0,
    "limit_expiry_bars": 8,
    "max_holding_days": 14,
    "risk_per_trade": 0.004,
    "max_positions": 4,
    "top_n": 2,
    "bottom_n": 2,
    "breadth_threshold": 0.5,
    "min_theme_score": 0.55,
    "risk_off_shorts": false,
    "max_gross_leverage": 1.0,
    "symbol_max_leverage": 1.0,
    "cancel_on_regime_flip": true,
    "strategy_family": "regime_limit_retest",
    "event_only": false,
    "required_regime": null,
    "required_daily_direction": null,
    "min_consecutive_green_1h": null,
    "max_consecutive_green_1h": null,
    "min_prior_consecutive_green_1h": null,
    "max_prior_consecutive_green_1h": null,
    "min_volume_multiple": null,
    "require_rejection_candle": false,
    "min_rejection_fraction": null,
    "relative_return_window": 1,
    "min_relative_return": null,
    "min_funding_rate": null,
    "require_funding": false,
    "max_holding_hours": null,
    "regime_model": "legacy",
    "volatility_window": 20,
    "volatility_lookback": 120,
    "volatility_stress_percentile": 0.9,
    "funding_data_available": false
  }
}
